title,selftext,subreddit
kitten adoption puente,kitten adoption puente,LosAngeles
restaurant year,restaurant year,LosAngeles
daily discussion thread,daily discussion thread,LosAngeles
way deliver baked across,way deliver baked across,LosAngeles
lady nearly hit dog crossing street crosswalk fuck,lady nearly hit dog crossing street crosswalk fuck,LosAngeles
coffee tasting group,coffee tasting group,LosAngeles
trip ojai see,trip ojai see,LosAngeles
ticket madame gandhi concert,ticket madame gandhi concert,LosAngeles
solid biking spot,solid biking spot,LosAngeles
vip travelling north tonight,vip travelling north tonight,LosAngeles
since drive job happens finally got got parking police sure pay fine mail notice piling likely vehicle impounded,since drive job happens finally got got parking police sure pay fine mail notice piling likely vehicle impounded,LosAngeles
studio,studio,LosAngeles
laxit work,laxit work,LosAngeles
travelling,travelling,LosAngeles
thanks post malone howlin ray delivered postmates week,thanks post malone howlin ray delivered postmates week,LosAngeles
leave lax,leave lax,LosAngeles
try open mic standup west side,try open mic standup west side,LosAngeles
lunch spot west side getty villa,lunch spot west side getty villa,LosAngeles
klos claim steve jones return air friday,klos claim steve jones return air friday,LosAngeles
worth move,worth move,LosAngeles
annual restaurant,annual restaurant,LosAngeles
restaurant list,restaurant list,LosAngeles
filing pothole damage reimbursement,filing pothole damage reimbursement,LosAngeles
robbery pan pacific park,robbery pan pacific park,LosAngeles
daily discussion thread,daily discussion thread,LosAngeles
work realized pant tight fat guy help,work realized pant tight fat guy help,LosAngeles
motorcyclist careful saw accident semi,motorcyclist careful saw accident semi,LosAngeles
giorgiporgi coffee ever closed help,giorgiporgi coffee ever closed help,LosAngeles
nearly cop fitness van nuys milling around gym depleting namaste going yoga,nearly cop fitness van nuys milling around gym depleting namaste going yoga,LosAngeles
death scare v xmas train,death scare v xmas train,LosAngeles
doe use reverse osmosis filter filtration system hard water,doe use reverse osmosis filter filtration system hard water,LosAngeles
look nye event,look nye event,LosAngeles
bat venue hang play joel,bat venue hang play joel,LosAngeles
lost cat northridge,lost cat northridge,LosAngeles
anybody little rose glass tube,anybody little rose glass tube,LosAngeles
lost cat reward found,lost cat reward found,LosAngeles
fonda theater,fonda theater,LosAngeles
spectrum else,spectrum else,LosAngeles
north side venice blvd western west bridge overpass sinking towards median,north side venice blvd western west bridge overpass sinking towards median,LosAngeles
visiting golf,visiting golf,LosAngeles
hal fishman spinning grave state local news,hal fishman spinning grave state local news,LosAngeles
help would appreciated,help would appreciated,LosAngeles
north merge apparently game chicken yield first zipper merge,north merge apparently game chicken yield first zipper merge,LosAngeles
christmas caroler soliciting donation inside restaurant,christmas caroler soliciting donation inside restaurant,LosAngeles
daily discussion thread,daily discussion thread,LosAngeles
going including age,going including age,LosAngeles
fast pas,fast pa,LosAngeles
guy got blowjob patio killer shrimp last night,guy got blowjob patio killer shrimp last night,LosAngeles
iphone smart battery case,iphone smart battery case,LosAngeles
bill sce edison month,bill sce edison month,LosAngeles
bafhafjw,bafhafjw,LosAngeles
mountain lion captured simi valley ate dog,mountain lion captured simi valley ate dog,LosAngeles
bday event space,bday event space,LosAngeles
south bend indiana mayor political comer peter buttgieg rape kill five boy buffalo jan buttgieg make child eat feces point gov andrew cuomo mayor bill deblasio present also kick rape party complete uncut audio,south bend indiana mayor political comer peter buttgieg rape kill five boy buffalo jan buttgieg make child eat feces point gov andrew cuomo mayor bill deblasio present also kick rape party complete uncut audio,LosAngeles
metro bus,metro bus,LosAngeles
take dog see snow weekend,take dog see snow weekend,LosAngeles
cheap wing,cheap wing,LosAngeles
stop trying fucking hustle auto body work right middle traffic,stop trying fucking hustle auto body work right middle traffic,LosAngeles
found wireleless earbud charging case red line morning,found wireleless earbud charging case red line morning,LosAngeles
toxic smell burning rubber south poinsettia park smell,toxic smell burning rubber south poinsettia park smell,LosAngeles
driving canyon,driving canyon,LosAngeles
safest expo line station,safest expo line station,LosAngeles
scenic overlook near drive,scenic overlook near drive,LosAngeles
melrose district stop sign suggestion,melrose district stop sign suggestion,LosAngeles
guess melrose district stop sign suggestion,guess melrose district stop sign suggestion,LosAngeles
many sub angry ride share stopping pick ups drop offs,many sub angry ride share stopping pick ups drop offs,LosAngeles
near lax advice stuff see,near lax advice stuff see,LosAngeles
recommend temp agency job yesterday,recommend temp agency job yesterday,LosAngeles
dpoli laxit rideshare pickup,dpoli laxit rideshare pickup,LosAngeles
england qb tom brady wife giselle visit buffalo january rape boy brady return three later rape chicago bear qb mitchell trubisky raping boy also full audio event,england qb tom brady wife giselle visit buffalo january rape boy brady return three later rape chicago bear qb mitchell trubisky raping boy also full audio event,LosAngeles
travelling accommodation recommendation,travelling accommodation recommendation,LosAngeles
january elopement,january elopement,LosAngeles
lax f king nightmare right reason think,lax f king nightmare right reason think,LosAngeles
possibly stolen light projector sold two guy car,possibly stolen light projector sold two guy car,LosAngeles
hard civil service job,hard civil service job,LosAngeles
tattoo shop,tattoo shop,LosAngeles
spectrum price increase,spectrum price increase,LosAngeles
primary care doctor referral hollywood amp glendale,primary care doctor referral hollywood amp glendale,LosAngeles
jefferson western taco stand shooting,jefferson western taco stand shooting,LosAngeles
nightlife,nightlife,LosAngeles
audio president donald j trump demand four billion dollar bribe child rapist take blind eye january becomes january,audio president donald j trump demand four billion dollar bribe child rapist take blind eye january becomes january,LosAngeles
magic mountain taking advatage fine print make sure happen,magic mountain taking advatage fine print make sure happen,LosAngeles
doe uber black pick lax curb,doe uber black pick lax curb,LosAngeles
wait lax better airport truly prioritizes shared transportation option,wait lax better airport truly prioritizes shared transportation option,LosAngeles
neighborhood buy house raise family decent commute dtla century,neighborhood buy house raise family decent commute dtla century,LosAngeles
cheap massage parlor actually massage stuff,cheap massage parlor actually massage stuff,LosAngeles
else experience profiling racism shadowing shopping macy,else experience profiling racism shadowing shopping macy,LosAngeles
fact way change,fact way change,LosAngeles
make reservation magic castle dec,make reservation magic castle dec,LosAngeles
please turn headlight,please turn headlight,LosAngeles
green coffee bean,green coffee bean,LosAngeles
upscale mexican food,upscale mexican food,LosAngeles
beer store allow mix match buy single,beer store allow mix match buy single,LosAngeles
something landlord fix,something landlord fix,LosAngeles
sm parking near second street,sm parking near second street,LosAngeles
uber lyft taxi ban lax,uber lyft taxi ban lax,LosAngeles
count nb cahuenga ramp,count nb cahuenga ramp,LosAngeles
else getting choppy audio ktla dc tv batwoman supergirl flash far show beginning week,else getting choppy audio ktla dc tv batwoman supergirl flash far show beginning week,LosAngeles
trying remember name small burger santa monica,trying remember name small burger santa monica,LosAngeles
whoever throw shit car window car follows driver rage seriously lose license life,whoever throw shit car window car follows driver rage seriously lose license life,LosAngeles
walking,walking,LosAngeles
loving change lax,loving change lax,LosAngeles
vicious dog going hard,vicious dog going hard,LosAngeles
rant samo beach cafe,rant samo beach cafe,LosAngeles
different lax story,different lax story,LosAngeles
amount rent ad say female damn high,amount rent ad say female damn high,LosAngeles
amount asking female renter damn high,amount asking female renter damn high,LosAngeles
daily discussion thread,daily discussion thread,LosAngeles
home insurance policy renewed citing wildfire risk,home insurance policy renewed citing wildfire risk,LosAngeles
homeless month full job making month tip,homeless month full job making month tip,LosAngeles
psa million plus l county reddit psa ineffective way spread message,psa million plus l county reddit psa ineffective way spread message,LosAngeles
night bar club coming within next week,night bar club coming within next week,LosAngeles
eagle rock old paper mache eagle top pillar colorodo,eagle rock old paper mache eagle top pillar colorodo,LosAngeles
smell satan asshole art district skid row little tokyo,smell satan asshole art district skid row little tokyo,LosAngeles
road ragers,road ragers,LosAngeles
dispensary give free stuff birthday,dispensary give free stuff birthday,LosAngeles
could enlist community help locate dingbat around,could enlist community help locate dingbat around,LosAngeles
finest,finest,LosAngeles
king night staple center,king night staple center,LosAngeles
audio president donald j trump demanding billion dollar bribe child rapist take blind eye january trump becomes january also big reason major network report,audio president donald j trump demanding billion dollar bribe child rapist take blind eye january trump becomes january also big reason major network report,LosAngeles
portrait tattoo artist worried cost wait let think top,portrait tattoo artist worried cost wait let think top,LosAngeles
local furniture farmhouse midcentury modern,local furniture farmhouse midcentury modern,LosAngeles
anybody else experienced shadowing profiling shopping macy,anybody else experienced shadowing profiling shopping macy,LosAngeles
psa prime shuttle still send private car pick curbside lax,psa prime shuttle still send private car pick curbside lax,LosAngeles
help tortured,help tortured,LosAngeles
anywhere showing aew ppv,anywhere showing aew ppv,LosAngeles
doubt work angela,doubt work angela,LosAngeles
park n fly lax permanently closed,park n fly lax permanently closed,LosAngeles
ladwp sewage cost way,ladwp sewage cost way,LosAngeles
thank fun,thank fun,LosAngeles
park rental car,park rental car,LosAngeles
ocean kayaking socal,ocean kayaking socal,LosAngeles
audio president donald j trump demanding billion dollar bribe child rapist take blind eye january trump becomes january also big reason major network report,audio president donald j trump demanding billion dollar bribe child rapist take blind eye january trump becomes january also big reason major network report,LosAngeles
got earthquake got homelessness got housing crisis even got unwanted lax,got earthquake got homelessness got housing crisis even got unwanted lax,LosAngeles
vacation,vacation,LosAngeles
independent record label store oddity seller flea market pop shop business oppurtunities,independent record label store oddity seller flea market pop shop business oppurtunities,LosAngeles
recommendation jeweler custom jewelry info inside,recommendation jeweler custom jewelry info inside,LosAngeles
purple air reliable checking since issue,purple air reliable checking since issue,LosAngeles
picking friend lax,picking friend lax,LosAngeles
anybody else feel wheezy last couple want make sure actually dying,anybody else feel wheezy last couple want make sure actually dying,LosAngeles
drillbit taylor cause homeless crisis,drillbit taylor cause homeless crisis,LosAngeles
welcoming interesting church sense community,welcoming interesting church sense community,LosAngeles
red light camera ticket,red light camera ticket,LosAngeles
expired registration car impounded quickest classic car impound,expired registration car impounded quickest classic car impound,LosAngeles
anyway tell filming,anyway tell filming,LosAngeles
currently staring ceiling contemplating everything,currently staring ceiling contemplating everything,LosAngeles
first sandwich,first sandwich,LosAngeles
small earthquake,small earthquake,LosAngeles
advice entertainment industry,advice entertainment industry,LosAngeles
big earthquake,big earthquake,LosAngeles
daily discussion thread,daily discussion thread,LosAngeles
bean last kroq kevin amp bean show,bean last kroq kevin amp bean show,LosAngeles
beach drive,beach drive,LosAngeles
going coffee festival weekend,going coffee festival weekend,LosAngeles
thanks info bean,thanks info bean,LosAngeles
smog marine layer,smog marine layer,LosAngeles
audio speaker house senator nancy pelosi accepting billion dollar bribe wealthy high profile child rapist safe passage asian boy border monterrey january next audio president donald trump,audio speaker house senator nancy pelosi accepting billion dollar bribe wealthy high profile child rapist safe passage asian boy border monterrey january next audio president donald trump,LosAngeles
experience blue collar work union,experience blue collar work union,LosAngeles
honk slowing make right turn fucking asshole,honk slowing make right turn fucking asshole,LosAngeles
getting away stealing social equity program victim failed war drug,getting away stealing social equity program victim failed war drug,LosAngeles
essay paper assistance,essay paper assistance,LosAngeles
missing mcon pork belly bowl similar,missing mcon pork belly bowl similar,LosAngeles
encounter type scam,encounter type scam,LosAngeles
first picking someone lax since rework anything,first picking someone lax since rework anything,LosAngeles
continue calling metro line color end,continue calling metro line color end,LosAngeles
first date idea,first date idea,LosAngeles
moving morningside gramercy park,moving morningside gramercy park,LosAngeles
building social circle,building social circle,LosAngeles
blue line reopens name,blue line reopens name,LosAngeles
job advice making move burbank,job advice making move burbank,LosAngeles
article restaurant bar fee,article restaurant bar fee,LosAngeles
drop lax,drop lax,LosAngeles
book urban planning leading high pollution,book urban planning leading high pollution,LosAngeles
income going medi cal income limit end year much fellow poor got advice,income going medi cal income limit end year much fellow poor got advice,LosAngeles
calabasas jersey shore,calabasas jersey shore,LosAngeles
dog birthday,dog birthday,LosAngeles
living vega better inland empire,living vega better inland empire,LosAngeles
update drunk driver crashed house venice beach,update drunk driver crashed house venice beach,LosAngeles
month month apartment near lax,month month apartment near lax,LosAngeles
lax getting rental car,lax getting rental car,LosAngeles
feed homeless,feed homeless,LosAngeles
venice beach update drunk hit run,venice beach update drunk hit run,LosAngeles
parasite movie discussion,parasite movie discussion,LosAngeles
carry pepper spray road,carry pepper spray road,LosAngeles
fante dialect ghana language teacher,fante dialect ghana language teacher,LosAngeles
lol still hot,lol still hot,LosAngeles
known bad traffic feel gotten way worse past year mean insane year,known bad traffic feel gotten way worse past year mean insane year,LosAngeles
uber lyft still dropoff lax,uber lyft still dropoff lax,LosAngeles
paying per kilowatt hour,paying per kilowatt hour,LosAngeles
smog haze,smog haze,LosAngeles
pick soccer,pick soccer,LosAngeles
event christmas idea girlfriend,event christmas idea girlfriend,LosAngeles
silver line,silver line,LosAngeles
weekend discussion thread,weekend discussion thread,LosAngeles
rental car shuttle situation lax,rental car shuttle situation lax,LosAngeles
renting riding bike northridge public transportation,renting riding bike northridge public transportation,LosAngeles
ride share pick trashed lax sound self parking garage unaffected amiright,ride share pick trashed lax sound self parking garage unaffected amiright,LosAngeles
native amp full accountant cpa acting start,native amp full accountant cpa acting start,LosAngeles
help finding info shooting hollywood,help finding info shooting hollywood,LosAngeles
landlord penalities notice rent hike,landlord penalities notice rent hike,LosAngeles
showtime indie theatre spot,showtime indie theatre spot,LosAngeles
audio speaker house senator nancy pelosi accepting billion dollar bribe wealthy high profile child rapist safe passage asian boy border monterrey january senator charles schumer rape kill boy later afternoon,audio speaker house senator nancy pelosi accepting billion dollar bribe wealthy high profile child rapist safe passage asian boy border monterrey january senator charles schumer rape kill boy later afternoon,LosAngeles
interview someone life south central preferably mile grocery store food desert college research project,interview someone life south central preferably mile grocery store food desert college research project,LosAngeles
taking trip long beach purely metro,taking trip long beach purely metro,LosAngeles
whale sighting manhattan beach pier,whale sighting manhattan beach pier,LosAngeles
serious advice,serious advice,LosAngeles
sugarfish gt nobu,sugarfish gt nobu,LosAngeles
coffee festival worth,coffee festival worth,LosAngeles
audio speaker house senator nancy pelosi accepting billion dollar bribe wealthy high profile child rapist safe passage asian boy border monterrey january senator charles schumer rape kill boy later afternoon,audio speaker house senator nancy pelosi accepting billion dollar bribe wealthy high profile child rapist safe passage asian boy border monterrey january senator charles schumer rape kill boy later afternoon,LosAngeles
discussion ten million dollar monument architecture piece public art piece tourist trap experiential creative project see established,discussion ten million dollar monument architecture piece public art piece tourist trap experiential creative project see established,LosAngeles
work walgreens considering job want much cost healthcare,work walgreens considering job want much cost healthcare,LosAngeles
moving family wife child,moving family wife child,LosAngeles
razzle berry ring pop pegasus wing bird brain,razzle berry ring pop pegasus wing bird brain,LosAngeles
dmv online seeing appointment january,dmv online seeing appointment january,LosAngeles
nursing education requiring bachelor,nursing education requiring bachelor,LosAngeles
baldwin hill overlook,baldwin hill overlook,LosAngeles
got robbed,got robbed,LosAngeles
overnight parking beverly hill,overnight parking beverly hill,LosAngeles
lax short term parking uber black,lax short term parking uber black,LosAngeles
long term parking lax,long term parking lax,LosAngeles
someone explain choose wait line enter exit parking garage empty lane,someone explain choose wait line enter exit parking garage empty lane,LosAngeles
going camp flog gnaw,going camp flog gnaw,LosAngeles
east wanna hang uno,east wanna hang uno,LosAngeles
mental health amp eating disorder support group therapy clinic experience reference please,mental health amp eating disorder support group therapy clinic experience reference please,LosAngeles
lausd field open public weekend,lausd field open public weekend,LosAngeles
double decker freeway,double decker freeway,LosAngeles
baby shark party theme,baby shark party theme,LosAngeles
forum dummy,forum dummy,LosAngeles
event saturday nov,event saturday nov,LosAngeles
lax right,lax right,LosAngeles
blackout west,blackout west,LosAngeles
driving thru baja wednesday thursday,driving thru baja wednesday thursday,LosAngeles
mansion party,mansion party,LosAngeles
tried lucilles thanksgiving feast,tried lucilles thanksgiving feast,LosAngeles
book club dtla,book club dtla,LosAngeles
earthquake well rumbling least,earthquake well rumbling least,LosAngeles
free visit,free visit,LosAngeles
south bend mayor political amp comer peter buttgieg rape kill five boy buffalo january buttgieg make child eat feces point governor andrew cuomo mayor bill deblasio present also full audio,south bend mayor political amp comer peter buttgieg rape kill five boy buffalo january buttgieg make child eat feces point governor andrew cuomo mayor bill deblasio present also full audio,LosAngeles
lyft v uber study,lyft v uber study,LosAngeles
near l kid learn ski snowboard,near l kid learn ski snowboard,LosAngeles
watch super bowl,watch super bowl,LosAngeles
hollywood fire,hollywood fire,LosAngeles
daily news pay wall,daily news pay wall,LosAngeles
cheap rent county,cheap rent county,LosAngeles
jeez pacific amp washington venice,jeez pacific amp washington venice,LosAngeles
normal car wash,normal car wash,LosAngeles
quick,quick,LosAngeles
tonight saturday music live band karaoke moroccan lounge downtown great,tonight saturday music live band karaoke moroccan lounge downtown great,LosAngeles
rant cigaret cause cancer finally going ban smoking cigaret public space,rant cigaret cause cancer finally going ban smoking cigaret public space,LosAngeles
picking lax,picking lax,LosAngeles
essex community,essex community,LosAngeles
possible filming stoney point chatsworth,possible filming stoney point chatsworth,LosAngeles
basque cheesecake,basque cheesecake,LosAngeles
post bird,post bird,LosAngeles
stoner west hollywood wanna meet,stoner west hollywood wanna meet,LosAngeles
realistically mich live comfortably,realistically mich live comfortably,LosAngeles
recent update griffith park fire barhamfire,recent update griffith park fire barhamfire,LosAngeles
svf parent recs drop child care,svf parent recs drop child care,LosAngeles
proud post,proud post,LosAngeles
coming conference,coming conference,LosAngeles
reddit sleuth help identify crook,reddit sleuth help identify crook,LosAngeles
trip downtown sunday see,trip downtown sunday see,LosAngeles
psa monday veteran parking restriction effect,psa monday veteran parking restriction effect,LosAngeles
way lax,way lax,LosAngeles
reservation n naka,reservation n naka,LosAngeles
selling two ticket kanye sunday service forum pm,selling two ticket kanye sunday service forum pm,LosAngeles
buy fresh ultra hot pepper carolina reaper trinidad scorpion etc,buy fresh ultra hot pepper carolina reaper trinidad scorpion etc,LosAngeles
free tropicalia ticket,free tropicalia ticket,LosAngeles
buy car washington register moving buy,buy car washington register moving buy,LosAngeles
doe hate older,doe hate older,LosAngeles
seddy property inc lease concern,seddy property inc lease concern,LosAngeles
someone keep cancer patient company thanksgiving,someone keep cancer patient company thanksgiving,LosAngeles
set trash pickup,set trash pickup,LosAngeles
picking someone airport first,picking someone airport first,LosAngeles
taco taco taco,taco taco taco,LosAngeles
way predict metro train bus,way predict metro train bus,LosAngeles
single ready mingle spot yo straight guy,single ready mingle spot yo straight guy,LosAngeles
percentage handicap placard b,percentage handicap placard b,LosAngeles
doe g suck,doe g suck,LosAngeles
visiting l fot first,visiting l fot first,LosAngeles
daily discussion thread,daily discussion thread,LosAngeles
meet ups event,meet ups event,LosAngeles
psa run walk hike hollywood reservoir morning,psa run walk hike hollywood reservoir morning,LosAngeles
stop lapd nieghborhood prosecutor court corruption,stop lapd nieghborhood prosecutor court corruption,LosAngeles
money exchange,money exchange,LosAngeles
vote vote working veteran,vote vote working veteran,LosAngeles
fatigue mild headache amp soreness fire flu,fatigue mild headache amp soreness fire flu,LosAngeles
glass repair,glass repair,LosAngeles
false fire alarm apartment building,false fire alarm apartment building,LosAngeles
free food meal,free food meal,LosAngeles
little ethiopia,little ethiopia,LosAngeles
metro expanded subway metro various major u,metro expanded subway metro various major u,LosAngeles
dumped girl,dumped girl,LosAngeles
doe homeless epidemic socal compare major american,doe homeless epidemic socal compare major american,LosAngeles
curious going purchase recently purchased home,curious going purchase recently purchased home,LosAngeles
affordable studio,affordable studio,LosAngeles
freeway work zone,freeway work zone,LosAngeles
interview project,interview project,LosAngeles
planning trip tip advice please,planning trip tip advice please,LosAngeles
pas smog,pa smog,LosAngeles
hell x piece plywood cut hard,hell x piece plywood cut hard,LosAngeles
visiting week,visiting week,LosAngeles
feeling restless make feel traveling somewhere else world,feeling restless make feel traveling somewhere else world,LosAngeles
moving ireland,moving ireland,LosAngeles
chinese theatre,chinese theatre,LosAngeles
french family protest front michael hestrin office october please join spread word read post detail,french family protest front michael hestrin office october please join spread word read post detail,LosAngeles
dave hot chicken v howlin ray,dave hot chicken v howlin ray,LosAngeles
cabin camping near ish,cabin camping near ish,LosAngeles
real beaten path haunted,real beaten path haunted,LosAngeles
air quality bad,air quality bad,LosAngeles
