title,selftext,subreddit
commuting ucla sfv public transit,commuting ucla sfv public transit,LosAngeles
dog owner entitlement chart,dog owner entitlement chart,LosAngeles
fun show date night,fun show date night,LosAngeles
vote change aura,vote change aura,LosAngeles
earthquake,earthquake,LosAngeles
candidate council,candidate council,LosAngeles
election changed vote feb march,election changed vote feb march,LosAngeles
bad torrent,bad torrent,LosAngeles
friend cancelled last minute,friend cancelled last minute,LosAngeles
f potential friend,f potential friend,LosAngeles
wag dog first feigned impeachment hearing attack iranian iraq trying distract amp cover retain power billion bribe highest office country death child rape prove loyalty,wag dog first feigned impeachment hearing attack iranian iraq trying distract amp cover retain power billion bribe highest office country death child rape prove loyalty,LosAngeles
favorite spot,favorite spot,LosAngeles
decent price book store,decent price book store,LosAngeles
used bike,used bike,LosAngeles
masturbating flasher silver lake reservoir,masturbating flasher silver lake reservoir,LosAngeles
first nice club dance recommendation,first nice club dance recommendation,LosAngeles
motorcade car honking iranian flag westwood,motorcade car honking iranian flag westwood,LosAngeles
coming spring tip,coming spring tip,LosAngeles
doe living venice suck,doe living venice suck,LosAngeles
chance climbing rope want climb point dume malibu tomorrow,chance climbing rope want climb point dume malibu tomorrow,LosAngeles
much spend month food per person shop,much spend month food per person shop,LosAngeles
californian song,californian song,LosAngeles
really stressful everyone act,really stressful everyone act,LosAngeles
building density sustainable truth afford probably never able afford move somewhere else pro nimby position,building density sustainable truth afford probably never able afford move somewhere else pro nimby position,LosAngeles
doe stanford harvard better reputation,doe stanford harvard better reputation,LosAngeles
jury duty contact school reporting week,jury duty contact school reporting week,LosAngeles
hope earthquake happens tonight,hope earthquake happens tonight,LosAngeles
recently got canon cam starting project year pplll film photo developed thanks,recently got canon cam starting project year pplll film photo developed thanks,LosAngeles
earthquake,earthquake,LosAngeles
felt shake brea,felt shake brea,LosAngeles
mover packer recs,mover packer recs,LosAngeles
lax thc vape,lax thc vape,LosAngeles
spectrum internet outage ne else,spectrum internet outage ne else,LosAngeles
heading airport transport option,heading airport transport option,LosAngeles
recommend restaurant west hollywood,recommend restaurant west hollywood,LosAngeles
whats deal fast food line,whats deal fast food line,LosAngeles
helicopter circling around near intersection venice culver blvds happenin,helicopter circling around near intersection venice culver blvds happenin,LosAngeles
night broadway,night broadway,LosAngeles
cast member needed religious debate show,cast member needed religious debate show,LosAngeles
recently found homeless big cousin struck amp killed train pronounced dead scene unidentified help direct information,recently found homeless big cousin struck amp killed train pronounced dead scene unidentified help direct information,LosAngeles
unsecured load old silverado west,unsecured load old silverado west,LosAngeles
saw lapd bombsquad going west,saw lapd bombsquad going west,LosAngeles
donate woman clothing,donate woman clothing,LosAngeles
lobster trap malibu legal poacher,lobster trap malibu legal poacher,LosAngeles
please help u,please help u,LosAngeles
heard friend med men abbott kinney currently raided police info,heard friend med men abbott kinney currently raided police info,LosAngeles
supposedly med men raided police info,supposedly med men raided police info,LosAngeles
interest business referral networking group u redditors,interest business referral networking group u redditors,LosAngeles
gang tagged house concerned,gang tagged house concerned,LosAngeles
taco guy feed bunch friend park,taco guy feed bunch friend park,LosAngeles
bar fight northridge mall yard house guy shot,bar fight northridge mall yard house guy shot,LosAngeles
idea start condo search help,idea start condo search help,LosAngeles
lax v car rental shuttle,lax v car rental shuttle,LosAngeles
lax amp car rental shuttle,lax amp car rental shuttle,LosAngeles
psa free chick fil socal resident duck finally scored goal home,psa free chick fil socal resident duck finally scored goal home,LosAngeles
psa free chick fil thanks duck,psa free chick fil thanks duck,LosAngeles
chick fil sandwich duck promo,chick fil sandwich duck promo,LosAngeles
daily discussion thread,daily discussion thread,LosAngeles
meet ups event,meet ups event,LosAngeles
icon dick van dyke,icon dick van dyke,LosAngeles
morning sunrise pic thread,morning sunrise pic thread,LosAngeles
anybody live cool modern house hill,anybody live cool modern house hill,LosAngeles
lakers dwight howard announces enter nba dunk contest first year,lakers dwight howard announces enter nba dunk contest first year,LosAngeles
google map idea thing along red expo blue gold line,google map idea thing along red expo blue gold line,LosAngeles
medical card id,medical card id,LosAngeles
wish hollywood elite would address local homeless crisis least,wish hollywood elite would address local homeless crisis least,LosAngeles
world basketball legend birthday,world basketball legend birthday,LosAngeles
buy used door,buy used door,LosAngeles
else notice missile sunset last night,else notice missile sunset last night,LosAngeles
housed two friend homeless,housed two friend homeless,LosAngeles
interesting subculture,interesting subculture,LosAngeles
westbound express bus santa monica blvd express bus wilshire blvd traffic avoided,westbound express bus santa monica blvd express bus wilshire blvd traffic avoided,LosAngeles
doe spiral staircase,doe spiral staircase,LosAngeles
spiral staircase orange county,spiral staircase orange county,LosAngeles
please come downstairs food delivery,please come downstairs food delivery,LosAngeles
dmv appointment santa monica driving test pas,dmv appointment santa monica driving test pa,LosAngeles
volunteering month,volunteering month,LosAngeles
paid service accompany dmv driving test,paid service accompany dmv driving test,LosAngeles
anybody gone beach sunny,anybody gone beach sunny,LosAngeles
missing male black white tuxedo cat brentwood near paul revere middle school brentwood,missing male black white tuxedo cat brentwood near paul revere middle school brentwood,LosAngeles
st vincent medical center closing,st vincent medical center closing,LosAngeles
wiltern,wiltern,LosAngeles
missing male tuxedo cat brentwood near paul revere middle school brentwood,missing male tuxedo cat brentwood near paul revere middle school brentwood,LosAngeles
wanting move let give accurate depiction every freeway pm,wanting move let give accurate depiction every freeway pm,LosAngeles
considering neighborhood live,considering neighborhood live,LosAngeles
north korean koreatown,north korean koreatown,LosAngeles
moving dtla lb pitbull east coast thought,moving dtla lb pitbull east coast thought,LosAngeles
,,LosAngeles
north korean restaurant,north korean restaurant,LosAngeles
taco guy,taco guy,LosAngeles
suit,suit,LosAngeles
oue skyspace party experience,oue skyspace party experience,LosAngeles
cafe blast loud music frequent tomtoms western love sometimes music loud,cafe blast loud music frequent tomtoms western love sometimes music loud,LosAngeles
green lab,green lab,LosAngeles
www nbclosangeles com news local man shot killed highland park police say,www nbclosangeles com news local man shot killed highland park police say,LosAngeles
someone knocked window laughed said hear,someone knocked window laughed said hear,LosAngeles
daily discussion thread,daily discussion thread,LosAngeles
kind awkward thing ask,kind awkward thing ask,LosAngeles
kind awkward thing say,kind awkward thing say,LosAngeles
travel tip,travel tip,LosAngeles
green left turn arrow mean something else state,green left turn arrow mean something else state,LosAngeles
interested joining competitive karaoke team,interested joining competitive karaoke team,LosAngeles
metro blue expo e line still broken upgrade,metro blue expo e line still broken upgrade,LosAngeles
til original name el pueblo de nuestra se os reina de ngeles del r porci ncula town lady queen angel river porciuncula,til original name el pueblo de nuestra se reina de ngeles del r porci ncula town lady queen angel river porciuncula,LosAngeles
wtb guest card magic castle hollywood,wtb guest card magic castle hollywood,LosAngeles
doe commute oc west side manage,doe commute oc west side manage,LosAngeles
party chateau marmont,party chateau marmont,LosAngeles
dear bicyclist getting honked open invitation stop middle street bike argue,dear bicyclist getting honked open invitation stop middle street bike argue,LosAngeles
rental feel scammy thought,rental feel scammy thought,LosAngeles
consumer right lawyer,consumer right lawyer,LosAngeles
dmv driving exam,dmv driving exam,LosAngeles
selling flyaway ticket,selling flyaway ticket,LosAngeles
advice help finding rent preferably around feliz,advice help finding rent preferably around feliz,LosAngeles
meet come sailing marina del rey sunday january,meet come sailing marina del rey sunday january,LosAngeles
basin way pacific tonight foothill san gabriel mountain oc,basin way pacific tonight foothill san gabriel mountain oc,LosAngeles
mechanic recommendation,mechanic recommendation,LosAngeles
executive assistant personal assistant,executive assistant personal assistant,LosAngeles
luxurious apartment homeless defecating entrance netflix uber full ascent outrageous leasing rent earth,luxurious apartment homeless defecating entrance netflix uber full ascent outrageous leasing rent earth,LosAngeles
meetup let sailing marina del rey sunday,meetup let sailing marina del rey sunday,LosAngeles
country viagra backpack,country viagra backpack,LosAngeles
thank kind stranger,thank kind stranger,LosAngeles
daily discussion thread,daily discussion thread,LosAngeles
visiting philly,visiting philly,LosAngeles
bar downtown pick college chick,bar downtown pick college chick,LosAngeles
ladwp mechanical associate position got score,ladwp mechanical associate position got score,LosAngeles
doe work bird corporate office,doe work bird corporate office,LosAngeles
old barn house record found sound horror movie score,old barn house record found sound horror movie score,LosAngeles
found underground network dope experience,found underground network dope experience,LosAngeles
make crazy money,make crazy money,LosAngeles
class action law enforcement filed sexual assault victim,class action law enforcement filed sexual assault victim,LosAngeles
doe recommendation art studio rent,doe recommendation art studio rent,LosAngeles
child rape org covered trump billion bribe pelosi also rec b safe passage border rapist include barr schumer soros wray deblasio alito trump obama arodgers tbrady death rape buffalo jan billion payoff see page amp latest update,child rape org covered trump billion bribe pelosi also rec b safe passage border rapist include barr schumer soros wray deblasio alito trump obama arodgers tbrady death rape buffalo jan billion payoff see page amp latest update,LosAngeles
small tan chihuahua spotted freeway right harvey dr exit,small tan chihuahua spotted freeway right harvey dr exit,LosAngeles
lot cop helicopter around olympic near westwood idea going,lot cop helicopter around olympic near westwood idea going,LosAngeles
psa white van scam,psa white van scam,LosAngeles
bacanora purchase,bacanora purchase,LosAngeles
renting guy value rental guy think current next rental worth rent,renting guy value rental guy think current next rental worth rent,LosAngeles
lost kitten near lucas,lost kitten near lucas,LosAngeles
give advice ccw,give advice ccw,LosAngeles
recently moved ktown dmv,recently moved ktown dmv,LosAngeles
else flu,else flu,LosAngeles
never walk staight,never walk staight,LosAngeles
anybody anything radio,anybody anything radio,LosAngeles
route commute pasadena santa monica,route commute pasadena santa monica,LosAngeles
elysian park trail near central,elysian park trail near central,LosAngeles
similar jealousy party brunch music open earlier jealousy open pm,similar jealousy party brunch music open earlier jealousy open pm,LosAngeles
restaurant biryani,restaurant biryani,LosAngeles
top,top,LosAngeles
power ktown first year else,power ktown first year else,LosAngeles
always ton labrea venice gas station taco truck really hype pink,always ton labrea venice gas station taco truck really hype pink,LosAngeles
possible hit run north wilshire pm,possible hit run north wilshire pm,LosAngeles
iso club,iso club,LosAngeles
stella donnelly teragram ballroom,stella donnelly teragram ballroom,LosAngeles
widening project knott avenue almost finished florence avenue valley view street left look nice compared original freeway,widening project knott avenue almost finished florence avenue valley view street left look nice compared original freeway,LosAngeles
typicallosangelesuberpickup,typicallosangelesuberpickup,LosAngeles
pm school fire alarm going call,pm school fire alarm going call,LosAngeles
authentic italian coffee bar,authentic italian coffee bar,LosAngeles
request course cinema english business,request course cinema english business,LosAngeles
romantic hotel,romantic hotel,LosAngeles
typicallosangelesworkday,typicallosangelesworkday,LosAngeles
fun thing past pm,fun thing past pm,LosAngeles
attempted burglary ktown,attempted burglary ktown,LosAngeles
daily discussion thread,daily discussion thread,LosAngeles
trip feb weather tip,trip feb weather tip,LosAngeles
lax,lax,LosAngeles
motown jack swing,motown jack swing,LosAngeles
else noticed lot dried weed dispensary,else noticed lot dried weed dispensary,LosAngeles
sailing meetup sunday january marina del rey,sailing meetup sunday january marina del rey,LosAngeles
ballot measure would tighten rule dealing bad street behavior,ballot measure would tighten rule dealing bad street behavior,LosAngeles
often rant past generation angelenos doomed u failing build public transportation reading book published give little insight issue,often rant past generation angelenos doomed u failing build public transportation reading book published give little insight issue,LosAngeles
magic castle pass,magic castle pas,LosAngeles
house party let shoot indie music video background,house party let shoot indie music video background,LosAngeles
census bureau hire thousand,census bureau hire thousand,LosAngeles
visit first food recommendation,visit first food recommendation,LosAngeles
wedding dj,wedding dj,LosAngeles
ben kweller fan,ben kweller fan,LosAngeles
walkable neighborhood live nearby century food activity nightlife budget month,walkable neighborhood live nearby century food activity nightlife budget month,LosAngeles
rent studio bedroom,rent studio bedroom,LosAngeles
landlord absolve damage tenant personal property,landlord absolve damage tenant personal property,LosAngeles
doe play lol,doe play lol,LosAngeles
volunteer opportunity,volunteer opportunity,LosAngeles
uber credit ride,uber credit ride,LosAngeles
icon sub,icon sub,LosAngeles
european aware,european aware,LosAngeles
help,help,LosAngeles
depression doe anybody cbt group,depression doe anybody cbt group,LosAngeles
metro express lane website penalized,metro express lane website penalized,LosAngeles
weekend discussion thread,weekend discussion thread,LosAngeles
hate,hate,LosAngeles
paid research study smartphone study earn,paid research study smartphone study earn,LosAngeles
uber work car blocking,uber work car blocking,LosAngeles
look housing,look housing,LosAngeles
fun night idea boyfriend hate club neither u dancing comedy music video game,fun night idea boyfriend hate club neither u dancing comedy music video game,LosAngeles
walk around starting union station,walk around starting union station,LosAngeles
street light barham cahuenga bridge,street light barham cahuenga bridge,LosAngeles
county employee around,county employee around,LosAngeles
roof repair eagle rock,roof repair eagle rock,LosAngeles
could snowshoeing tomorrow friday,could snowshoeing tomorrow friday,LosAngeles
snoop ticket wiltern tonight,snoop ticket wiltern tonight,LosAngeles
moving alone next july advice settling making friend connection early possible,moving alone next july advice settling making friend connection early possible,LosAngeles
lab grown diamond,lab grown diamond,LosAngeles
start petition take lit worst enemy kroq,start petition take lit worst enemy kroq,LosAngeles
throw homeless poor,throw homeless poor,LosAngeles
landed,landed,LosAngeles
flu shot,flu shot,LosAngeles
birthday everyone love town,birthday everyone love town,LosAngeles
dispensary help,dispensary help,LosAngeles
average rent increased since april,average rent increased since april,LosAngeles
county seek parcel tax firefighting fund,county seek parcel tax firefighting fund,LosAngeles
free ticket friend pop tonight pm sm,free ticket friend pop tonight pm sm,LosAngeles
fonda theatre ga floor balcony,fonda theatre ga floor balcony,LosAngeles
metro disneyland knotts berry,metro disneyland knotts berry,LosAngeles
employment development department,employment development department,LosAngeles
many actually pay fare metro train,many actually pay fare metro train,LosAngeles
lax passenger pickup p,lax passenger pickup p,LosAngeles
obtain medi cal coveredca proof loss coverage letter insurer,obtain medi cal coveredca proof loss coverage letter insurer,LosAngeles
bound,bound,LosAngeles
lost key montebello,lost key montebello,LosAngeles
broguiere egg nog,broguiere egg nog,LosAngeles
finding drug,finding drug,LosAngeles
guess girl ugly guy say beautiful,guess girl ugly guy say beautiful,LosAngeles
weird weather lightning seen yesterday evening sherman oak else see could looked cloud fire second,weird weather lightning seen yesterday evening sherman oak else see could looked cloud fire second,LosAngeles
hi,hi,LosAngeles
mental health insurance,mental health insurance,LosAngeles
help locate please,help locate please,LosAngeles
weekend discussion thread,weekend discussion thread,LosAngeles
breakfast recommendation,breakfast recommendation,LosAngeles
hidden gem finding room rent,hidden gem finding room rent,LosAngeles
watching ruiz v joshua fight saturday,watching ruiz v joshua fight saturday,LosAngeles
downtown doe pb amp j burger,downtown doe pb amp j burger,LosAngeles
avenger tlc handprint,avenger tlc handprint,LosAngeles
else feel hit run driver,else feel hit run driver,LosAngeles
christmas song feature,christmas song feature,LosAngeles
year eve yo canadian vacation,year eve yo canadian vacation,LosAngeles
schiff nadler mueller raped amp killed boy buffalo night january trump earlier morning impeachment vehicle keeping power working together full audio proving entirely three admit collusion w president updated pdf,schiff nadler mueller raped amp killed boy buffalo night january trump earlier morning impeachment vehicle keeping power working together full audio proving entirely three admit collusion w president updated pdf,LosAngeles
candy cane lane,candy cane lane,LosAngeles
considering going scientology open house shit giggle bad idea,considering going scientology open house shit giggle bad idea,LosAngeles
apartment landlord mail,apartment landlord mail,LosAngeles
white van scam going dtla art district right,white van scam going dtla art district right,LosAngeles
take old floppy copied usb cloud,take old floppy copied usb cloud,LosAngeles
trying hangout,trying hangout,LosAngeles
fool traffic move,fool traffic move,LosAngeles
starting think fool traffic move,starting think fool traffic move,LosAngeles
fix record player take,fix record player take,LosAngeles
earthquake,earthquake,LosAngeles
help needed cat trapped vine hollywood,help needed cat trapped vine hollywood,LosAngeles
hi fellow reddit user long reader first poster currently vacation wife staying hotel near universal studio watch ruiz joshua fight tomorrow,hi fellow reddit user long reader first poster currently vacation wife staying hotel near universal studio watch ruiz joshua fight tomorrow,LosAngeles
run rose bowl loop flea market,run rose bowl loop flea market,LosAngeles
vacant housing unit outnumber homeless,vacant housing unit outnumber homeless,LosAngeles
die hard,die hard,LosAngeles
doe raccoon seen since moved please provide pic,doe raccoon seen since moved please provide pic,LosAngeles
could ballot ban circumcision survive,could ballot ban circumcision survive,LosAngeles
teen work weekend,teen work weekend,LosAngeles
watching boxing recommendation please,watching boxing recommendation please,LosAngeles
spread word,spread word,LosAngeles
lowkey great nightlife spot,lowkey great nightlife spot,LosAngeles
interested playing organized street ball hockey,interested playing organized street ball hockey,LosAngeles
coyote valley,coyote valley,LosAngeles
low rumble heard ktown crenshaw,low rumble heard ktown crenshaw,LosAngeles
almost acoustic christmas sunday,almost acoustic christmas sunday,LosAngeles
mueller nadler amp schiff rape kill boy buffalo night jan trump earlier morning impeachment vehicle keeping power working together also pelosi full audio proving entirely three admit collusion president die,mueller nadler amp schiff rape kill boy buffalo night jan trump earlier morning impeachment vehicle keeping power working together also pelosi full audio proving entirely three admit collusion president die,LosAngeles
sherman way always spoken sherman way never sherman,sherman way always spoken sherman way never sherman,LosAngeles
universal studio hollywood december,universal studio hollywood december,LosAngeles
doe sell cool ornament around,doe sell cool ornament around,LosAngeles
doe tailor around socal recommend,doe tailor around socal recommend,LosAngeles
play pickup basketball f evening,play pickup basketball f evening,LosAngeles
advice free event could take dad senior health condition,advice free event could take dad senior health condition,LosAngeles
uhmmm,uhmmm,LosAngeles
hip hop rap open mic event,hip hop rap open mic event,LosAngeles
f losangeles fun home alone going crazy please pic inside,f losangeles fun home alone going crazy please pic inside,LosAngeles
behind name street name san fernando valley,behind name street name san fernando valley,LosAngeles
ski dazzle show year worth attending,ski dazzle show year worth attending,LosAngeles
buy wedding dress,buy wedding dress,LosAngeles
jury summons sanction show cause hearing,jury summons sanction show cause hearing,LosAngeles
want try cucked,want try cucked,LosAngeles
boy canada,boy canada,LosAngeles
jewish girlfriend,jewish girlfriend,LosAngeles
boy,boy,LosAngeles
cyclavia valley sherman way,cyclavia valley sherman way,LosAngeles
possible passport year old saturday,possible passport year old saturday,LosAngeles
ask landlord matching wall paint,ask landlord matching wall paint,LosAngeles
affordable art,affordable art,LosAngeles
ralph employee got subreddit work kroger company,ralph employee got subreddit work kroger company,LosAngeles
doe charge reporting flooding street send truck remove flooding,doe charge reporting flooding street send truck remove flooding,LosAngeles
cd peddler,cd peddler,LosAngeles
tip cleaning shower,tip cleaning shower,LosAngeles
hiking,hiking,LosAngeles
bathroom union station small,bathroom union station small,LosAngeles
adus trojan horse housing crisis,adus trojan horse housing crisis,LosAngeles
apt dweller live building forcing seismic retrofit,apt dweller live building forcing seismic retrofit,LosAngeles
current advice leaving lax,current advice leaving lax,LosAngeles
clipper v golden state,clipper v golden state,LosAngeles
warrior clipper,warrior clipper,LosAngeles
downtown spot drink dancing,downtown spot drink dancing,LosAngeles
make funk p funk want funked funk,make funk p funk want funked funk,LosAngeles
live co living,live co living,LosAngeles
daily discussion thread,daily discussion thread,LosAngeles
meet ups event,meet ups event,LosAngeles
help cal state northridge christmas bird count san fernando valley audubon society experience needed,help cal state northridge christmas bird count san fernando valley audubon society experience needed,LosAngeles
growler december,growler december,LosAngeles
eat around disneyland,eat around disneyland,LosAngeles
traveling lax holiday real deal cannabis,traveling lax holiday real deal cannabis,LosAngeles
wailing dog,wailing dog,LosAngeles
father also buttslammer russell westbrook story,father also buttslammer russell westbrook story,LosAngeles
volunteer opportunity,volunteer opportunity,LosAngeles
barber burbank cutting asian guy hair,barber burbank cutting asian guy hair,LosAngeles
hang,hang,LosAngeles
give away video game console kid low income neighborhood reduce present future crime,give away video game console kid low income neighborhood reduce present future crime,LosAngeles
alternative,alternative,LosAngeles
whats everyone nye,whats everyone nye,LosAngeles
neighborhood live,neighborhood live,LosAngeles
uber ing downtown inland empire saturday night,uber ing downtown inland empire saturday night,LosAngeles
psa skeet still,psa skeet still,LosAngeles
sport team fairly popular inn county,sport team fairly popular inn county,LosAngeles
moving,moving,LosAngeles
guy gold suit laurel canyon,guy gold suit laurel canyon,LosAngeles
throw away metro tap card getting scammed,throw away metro tap card getting scammed,LosAngeles
holiday gift appliance repair neighbor,holiday gift appliance repair neighbor,LosAngeles
