title,selftext,subreddit
coffee shop open hour brooklyn,coffee shop open hour brooklyn,nyc
hook pre rolled joint square,hook pre rolled joint square,nyc
irish potato soup manhattan,irish potato soup manhattan,nyc
wierdo peeper,wierdo peeper,nyc
connection w snl nbc,connection w snl nbc,nyc
breather,breather,nyc
subreddit ask recommendation visiting living,subreddit ask recommendation visiting living,nyc
tried flixbus boston,tried flixbus boston,nyc
lost car key uws,lost car key uws,nyc
free event kid,free event kid,nyc
ping pong pop december free food drink purchase ticket,ping pong pop december free food drink purchase ticket,nyc
thing pop ups free food exclusive event,thing pop ups free food exclusive event,nyc
doe bar showing uk election coverage thursday,doe bar showing uk election coverage thursday,nyc
really become twat,really become twat,nyc
bushwick loft party,bushwick loft party,nyc
injury attorney,injury attorney,nyc
queen isp service especially first year,queen isp service especially first year,nyc
monk,monk,nyc
beach near lemon creek staten island,beach near lemon creek staten island,nyc
first apartment touring tomorrow red flag definitely look,first apartment touring tomorrow red flag definitely look,nyc
fun wedding,fun wedding,nyc
help slanted floor bedroom,help slanted floor bedroom,nyc
wondering could necessity,wondering could necessity,nyc
please help class project,please help class project,nyc
got video crackhead n train astoria ditmars rn,got video crackhead n train astoria ditmars rn,nyc
dancing,dancing,nyc
old joke staten island,old joke staten island,nyc
oscar v healthfirst,oscar v healthfirst,nyc
ridgewood queen safe,ridgewood queen safe,nyc
taking film trip december nd,taking film trip december nd,nyc
rent price,rent price,nyc
midtown sit read book use laptop,midtown sit read book use laptop,nyc
spend awesome night spend,spend awesome night spend,nyc
also assaulted hammer union square l train,also assaulted hammer union square l train,nyc
assaulted hammer l train,assaulted hammer l train,nyc
korea town,korea town,nyc
halva bagel amp lox brooklyn,halva bagel amp lox brooklyn,nyc
schitt creek pop ticket release,schitt creek pop ticket release,nyc
cheap dental care student dentist nyu college dentistry,cheap dental care student dentist nyu college dentistry,nyc
haircut tipping,haircut tipping,nyc
nyct paygo recover,nyct paygo recover,nyc
garment district fabric advice,garment district fabric advice,nyc
father also buttslammer russell westbrook story,father also buttslammer russell westbrook story,nyc
selling pixy ticket tonight make anymore,selling pixy ticket tonight make anymore,nyc
climate change happens waterfront community doe affect population decline,climate change happens waterfront community doe affect population decline,nyc
mob neighborhood safest offer quality life,mob neighborhood safest offer quality life,nyc
psa tonight golf umbrella jump front train preferably rush hour,psa tonight golf umbrella jump front train preferably rush hour,nyc
doe anything varick street bum,doe anything varick street bum,nyc
cop arrest,cop arrest,nyc
doe anything group facetime call keep receiving throughout daily basis,doe anything group facetime call keep receiving throughout daily basis,nyc
sub full asshole,sub full asshole,nyc
medium speak recycle er,medium speak recycle er,nyc
crowded subway step morning far along stop route,crowded subway step morning far along stop route,nyc
sale x ticket frozen broadway thurs dec,sale x ticket frozen broadway thurs dec,nyc
want local item mexico,want local item mexico,nyc
sale x ticket christmas spectacular starring radio rockettes,sale x ticket christmas spectacular starring radio rockettes,nyc
year eve black tie celebration budget,year eve black tie celebration budget,nyc
went inside porn theater king highway,went inside porn theater king highway,nyc
president sec state amp defense fbi director u atty general supreme court justice house speaker senator governor mayor local police bribed protect child rapist wtf proof put away,president sec state amp defense fbi director u atty general supreme court justice house speaker senator governor mayor local police bribed protect child rapist wtf proof put away,nyc
happens nypd truancy van pick skipping school,happens nypd truancy van pick skipping school,nyc
going east village lot fire engine smell smoke,going east village lot fire engine smell smoke,nyc
feel matter parent antonio williams man killed police demand answer nypd de blasio,feel matter parent antonio williams man killed police demand answer nypd de blasio,nyc
gourmet grocery store,gourmet grocery store,nyc
busmanity com charter bus amp limo company booking service instant rate jersey lond island,busmanity com charter bus amp limo company booking service instant rate jersey lond island,nyc
subway emergency brake,subway emergency brake,nyc
moving soon selling macbook pro locally,moving soon selling macbook pro locally,nyc
local buy ship exclusive allbirds desperate texas guy,local buy ship exclusive allbirds desperate texas guy,nyc
many think masturbate window island manhattan daily basis,many think masturbate window island manhattan daily basis,nyc
since thanksgiving daily ritual listen woman complain heat crowd wearing jacket til lunch,since thanksgiving daily ritual listen woman complain heat crowd wearing jacket til lunch,nyc
male strip club set show,male strip club set show,nyc
smoking crack subway,smoking crack subway,nyc
hard sleep,hard sleep,nyc
anniversary restaurant,anniversary restaurant,nyc
going back yellow cab instead uber lyft,going back yellow cab instead uber lyft,nyc
doe rubber room ama,doe rubber room ama,nyc
clean chinese restaurant close le year racism controversy,clean chinese restaurant close le year racism controversy,nyc
krispy kreme better dd,krispy kreme better dd,nyc
scent rockefeller center,scent rockefeller center,nyc
key fob payment,key fob payment,nyc
beetlejuice announces final broadway show,beetlejuice announces final broadway show,nyc
year eve music amp art festival claptone amp shiba san,year eve music amp art festival claptone amp shiba san,nyc
volunteering xmas,volunteering xmas,nyc
police ticketed using phone driving even though,police ticketed using phone driving even though,nyc
net v er ticket sale,net v er ticket sale,nyc
broadway lafayette station interviewer,broadway lafayette station interviewer,nyc
wtf going jersey right,wtf going jersey right,nyc
thanking fantastic,thanking fantastic,nyc
alone year eve pm want adventure,alone year eve pm want adventure,nyc
south bend indiana mayor political comer peter buttgieg rape amp kill five boy buffalo january buttgieg make child eat feces point gov andrew cuomo amp mayor bill deblasio present also kick rape party complete uncut audio,south bend indiana mayor political comer peter buttgieg rape amp kill five boy buffalo january buttgieg make child eat feces point gov andrew cuomo amp mayor bill deblasio present also kick rape party complete uncut audio,nyc
sister jeweler little italy vendor,sister jeweler little italy vendor,nyc
film shooting ridgewood week,film shooting ridgewood week,nyc
want avoid gentrification would,want avoid gentrification would,nyc
hangout luggage,hangout luggage,nyc
pooyork,pooyork,nyc
rikers island report mckinsey bogus data propublica,rikers island report mckinsey bogus data propublica,nyc
pooyork,pooyork,nyc
way around manhattan,way around manhattan,nyc
pooyork,pooyork,nyc
pooyork,pooyork,nyc
sell comic,sell comic,nyc
careful homeless,careful homeless,nyc
voter database electronic,voter database electronic,nyc
year old visiting alone,year old visiting alone,nyc
commuting nj getting,commuting nj getting,nyc
found wallet,found wallet,nyc
england qb tom brady amp wife giselle visit buffalo january rape boy brady return three later rape chicago bear qb mitchell trubisky raping boy also full audio event,england qb tom brady amp wife giselle visit buffalo january rape boy brady return three later rape chicago bear qb mitchell trubisky raping boy also full audio event,nyc
open mic karaoke,open mic karaoke,nyc
dear live manhattan outerborughs train connection car shut,dear live manhattan outerborughs train connection car shut,nyc
moving,moving,nyc
noticed lot brooklyn landlord rent white tenant anything,noticed lot brooklyn landlord rent white tenant anything,nyc
paradoxity pop gallery,paradoxity pop gallery,nyc
anybody strong opinion prop budget,anybody strong opinion prop budget,nyc
black crime highest subway,black crime highest subway,nyc
buy pepper spray,buy pepper spray,nyc
webster hall late night,webster hall late night,nyc
sharing big google sheet restaurant rate w,sharing big google sheet restaurant rate w,nyc
audio president donald j trump demand four billion dollar bribe child rapist take blind eye january becomes january,audio president donald j trump demand four billion dollar bribe child rapist take blind eye january becomes january,nyc
weekend square,weekend square,nyc
ballot item result,ballot item result,nyc
homeless crazy compared decade ago,homeless crazy compared decade ago,nyc
would someone want non refillable empty metrocard,would someone want non refillable empty metrocard,nyc
relationship really hard,relationship really hard,nyc
felt compelled share,felt compelled share,nyc
see guy screaming front starbucks court st awful,see guy screaming front starbucks court st awful,nyc
selling three ticket caamp brooklyn steel,selling three ticket caamp brooklyn steel,nyc
found glass train,found glass train,nyc
precinct reporting ranked choice voting become law point,precinct reporting ranked choice voting become law point,nyc
guy wanna call train,guy wanna call train,nyc
understanding address work,understanding address work,nyc
doe want hang,doe want hang,nyc
proposing rockefeller ice rink video,proposing rockefeller ice rink video,nyc
black homeownership rate lower white homeownership rate,black homeownership rate lower white homeownership rate,nyc
fart subway train,fart subway train,nyc
employment con edison,employment con edison,nyc
retail space rent,retail space rent,nyc
fare fight house party,fare fight house party,nyc
dog bite dog inside dog park within,dog bite dog inside dog park within,nyc
living tudor,living tudor,nyc
doe wanna help navigate friend,doe wanna help navigate friend,nyc
parking receipt needed,parking receipt needed,nyc
oculus path rant,oculus path rant,nyc
tell train uptown downtown,tell train uptown downtown,nyc
recommendation mover brooklyn,recommendation mover brooklyn,nyc
playing music speaker subway,playing music speaker subway,nyc
anywhere buy xiaomi phone,anywhere buy xiaomi phone,nyc
found dropped airpods street f station lost tuesday nov around pm,found dropped airpods street f station lost tuesday nov around pm,nyc
clairo show tonight,clairo show tonight,nyc
brazilian wax guy midtown,brazilian wax guy midtown,nyc
favorite restaurant eaten lately,favorite restaurant eaten lately,nyc
career requiring bachelor degree pay well exclusive,career requiring bachelor degree pay well exclusive,nyc
drs prescribe dexedrine desoxyn,drs prescribe dexedrine desoxyn,nyc
power supplier use,power supplier use,nyc
package stolen lobby,package stolen lobby,nyc
connection doe epstein kushner ivanka elite ramaz high school,connection doe epstein kushner ivanka elite ramaz high school,nyc
connection doe epstein ivanka kushner madoff ramaz high school,connection doe epstein ivanka kushner madoff ramaz high school,nyc
audio president donald j trump demanding billion dollar bribe child rapist take blind eye january trump becomes january also big reason major network report,audio president donald j trump demanding billion dollar bribe child rapist take blind eye january trump becomes january also big reason major network report,nyc
pizza spot,pizza spot,nyc
paid opinion study receive,paid opinion study receive,nyc
escape,escape,nyc
name top ten manhattan steakhouse,name top ten manhattan steakhouse,nyc
audio president donald j trump demanding billion dollar bribe child rapist take blind eye january trump becomes january also big reason major network report,audio president donald j trump demanding billion dollar bribe child rapist take blind eye january trump becomes january also big reason major network report,nyc
nypd fuck,nypd fuck,nyc
cheap honey,cheap honey,nyc
puerto rican west indie parade permanently banned,puerto rican west indie parade permanently banned,nyc
doe q run garbage,doe q run garbage,nyc
renting,renting,nyc
working paulus hook jersey live,working paulus hook jersey live,nyc
survey car owner enthusiast living westchester,survey car owner enthusiast living westchester,nyc
apache,apache,nyc
suggestion thing,suggestion thing,nyc
lounge seat msg live music concert,lounge seat msg live music concert,nyc
plan v reality renting apartment,plan v reality renting apartment,nyc
sell concert ticket,sell concert ticket,nyc
audio president trump demanding four billion dollar bribe child rapist take blind eye january trump becomes january also big reason major network report next pelosi involvement,audio president trump demanding four billion dollar bribe child rapist take blind eye january trump becomes january also big reason major network report next pelosi involvement,nyc
stuff around stand,stuff around stand,nyc
gift friend life,gift friend life,nyc
soundproof window,soundproof window,nyc
damn right stand comedy show ridgewood,damn right stand comedy show ridgewood,nyc
dermatologist brooklyn,dermatologist brooklyn,nyc
recommend cv writing coach un ngo job,recommend cv writing coach un ngo job,nyc
give undeniable feel,give undeniable feel,nyc
upcoming trip girlfriend end month staying uwc plan hitting borough non touristy recommendation local tip greatly appreciated thanks,upcoming trip girlfriend end month staying uwc plan hitting borough non touristy recommendation local tip greatly appreciated thanks,nyc
date idea,date idea,nyc
basement apartment public urination,basement apartment public urination,nyc
still without cooking gas month,still without cooking gas month,nyc
public transportation shuttle jfk rockland county,public transportation shuttle jfk rockland county,nyc
strip club,strip club,nyc
keep hearing pair gang called irish hood krazy drunken mix real,keep hearing pair gang called irish hood krazy drunken mix real,nyc
criminal mind let see jump bail donut,criminal mind let see jump bail donut,nyc
becky becky sleep rush hour train becky,becky becky sleep rush hour train becky,nyc
fundraiser pop comedy show network event,fundraiser pop comedy show network event,nyc
kid friendly watch ml cup,kid friendly watch ml cup,nyc
final date partner study abroad recommendation activity food,final date partner study abroad recommendation activity food,nyc
audio president trump demanding four billion dollar bribe child rapist take blind eye january trump becomes january also big reason major network report nancy pelosi involvement follows,audio president trump demanding four billion dollar bribe child rapist take blind eye january trump becomes january also big reason major network report nancy pelosi involvement follows,nyc
throw bar club near lower east side,throw bar club near lower east side,nyc
update golfer,update golfer,nyc
satisfying landlord karma,satisfying landlord karma,nyc
help,help,nyc
england qb tom brady wife giselle visit buffalo january rape boy tom brady gay anyway brady return three later rape kill bear qb trubisky dt mack blackhawks c pat kane raping boy also full audio event,england qb tom brady wife giselle visit buffalo january rape boy tom brady gay anyway brady return three later rape kill bear qb trubisky dt mack blackhawks c pat kane raping boy also full audio event,nyc
yorkers remember bloomberg mayoral run take,yorkers remember bloomberg mayoral run take,nyc
housing,housing,nyc
free enjoy finding deal airfare thought would share deal departing available moment,free enjoy finding deal airfare thought would share deal departing available moment,nyc
relocating jersey v brooklyn v queen,relocating jersey v brooklyn v queen,nyc
going mass protest front abc episteen cover,going mass protest front abc episteen cover,nyc
f alone bored wish could fun,f alone bored wish could fun,nyc
lost bag possession,lost bag possession,nyc
free join robinhood using link free stock worth,free join robinhood using link free stock worth,nyc
free thing,free thing,nyc
free health clinic,free health clinic,nyc
spot first snow,spot first snow,nyc
advice please month left lease,advice please month left lease,nyc
rate mta station crime panhandling,rate mta station crime panhandling,nyc
salon hair cut,salon hair cut,nyc
bus driver free program help obtain commercial driver license,bus driver free program help obtain commercial driver license,nyc
audio speaker house senator nancy pelosi accepting billion dollar bribe wealthy high profile child rapist safe passage asian boy border monterrey january senator charles schumer rape kill boy later afternoon,audio speaker house senator nancy pelosi accepting billion dollar bribe wealthy high profile child rapist safe passage asian boy border monterrey january senator charles schumer rape kill boy later afternoon,nyc
ice detaining questioning l train,ice detaining questioning l train,nyc
nypd protest,nypd protest,nyc
happened de blasio plan universal care bill,happened de blasio plan universal care bill,nyc
south bend indiana mayor political comer peter buttgieg rape kill five boy rape party buffalo january buttgieg make child eat feces point governor andrew cuomo mayor bill deblasio present also full audio,south bend indiana mayor political comer peter buttgieg rape kill five boy rape party buffalo january buttgieg make child eat feces point governor andrew cuomo mayor bill deblasio present also full audio,nyc
indoor rock climbing,indoor rock climbing,nyc
meet comfort zone come improv mindfulness workshop monday night detail post,meet comfort zone come improv mindfulness workshop monday night detail post,nyc
resident purchasing car nj private seller legally back register,resident purchasing car nj private seller legally back register,nyc
doe want ticket field medic concert brooklyn zone night,doe want ticket field medic concert brooklyn zone night,nyc
selling megabus ticket washington c friday november pm,selling megabus ticket washington c friday november pm,nyc
buying magen david manhattan,buying magen david manhattan,nyc
seem hate bloomberg,seem hate bloomberg,nyc
nice young bar lower manhattan meet,nice young bar lower manhattan meet,nyc
updated unemployment figure released november,updated unemployment figure released november,nyc
fucking radiator,fucking radiator,nyc
nicest nycha project,nicest nycha project,nyc
chef volunteer help cook soup kitchen,chef volunteer help cook soup kitchen,nyc
helicopter tour,helicopter tour,nyc
nypd seeking teen jumped turnstile stolen chalupas,nypd seeking teen jumped turnstile stolen chalupas,nyc
dakota building opened charged year large rental apartment,dakota building opened charged year large rental apartment,nyc
doe buy beef tongue,doe buy beef tongue,nyc
regarding bar hollywood rape culture,regarding bar hollywood rape culture,nyc
free wifi hotel lobby,free wifi hotel lobby,nyc
yet another reason de blasio end prison long,yet another reason de blasio end prison long,nyc
woman want see dating profile,woman want see dating profile,nyc
f chat potential meet,f chat potential meet,nyc
recommend hot dog,recommend hot dog,nyc
make platonic friend technological innovation advance would think would friend making apps way dating apps become mainstream idea,make platonic friend technological innovation advance would think would friend making apps way dating apps become mainstream idea,nyc
wing,wing,nyc
hi everyone gonna meeting guy midwest would show around nice general suggestion,hi everyone gonna meeting guy midwest would show around nice general suggestion,nyc
veteran plan join night comedy great cause,veteran plan join night comedy great cause,nyc
everyone critic,everyone critic,nyc
batting cage,batting cage,nyc
turnstile hopper,turnstile hopper,nyc
columbia university science honor program shp experience,columbia university science honor program shp experience,nyc
kind enjoyed watching police walk sb bus fine bunch decided pay fair,kind enjoyed watching police walk sb bus fine bunch decided pay fair,nyc
astoria bushwick,astoria bushwick,nyc
landlord stole security deposit,landlord stole security deposit,nyc
finally end jail corruption crime de blasio really hard schedule wise,finally end jail corruption crime de blasio really hard schedule wise,nyc
hiring someone pull public record clerk,hiring someone pull public record clerk,nyc
look wall vehicle along ave outside trump tower even see street almost look full scale military operation bizarre,look wall vehicle along ave outside trump tower even see street almost look full scale military operation bizarre,nyc
hire licensed selling broker flat fee,hire licensed selling broker flat fee,nyc
twin tower,twin tower,nyc
metro ticket,metro ticket,nyc
shoe,shoe,nyc
metro north station park,metro north station park,nyc
central park permit,central park permit,nyc
dated crazy girl miss,dated crazy girl miss,nyc
better none,better none,nyc
ever happened manolo cabeza de huevo,ever happened manolo cabeza de huevo,nyc
thrift shopping clothes,thrift shopping clothes,nyc
say burger town,say burger town,nyc
difference civic corp service corp,difference civic corp service corp,nyc
special trip daughter,special trip daughter,nyc
human uber life without dream,human uber life without dream,nyc
would interested single group,would interested single group,nyc
fare evasion summons,fare evasion summons,nyc
booming sound manhattan,booming sound manhattan,nyc
doe jackie robinson museum going open,doe jackie robinson museum going open,nyc
super odd icelandic hot dog,super odd icelandic hot dog,nyc
yorkers difference seen caping product since ban selling anymore,yorkers difference seen caping product since ban selling anymore,nyc
difference noticed vaping product since ban,difference noticed vaping product since ban,nyc
software engineer job hunt tip,software engineer job hunt tip,nyc
noticed upcoming event street festival,noticed upcoming event street festival,nyc
trying bar venue manhattan went around year ago,trying bar venue manhattan went around year ago,nyc
thought early,thought early,nyc
rent car service manhattan,rent car service manhattan,nyc
phone kill,phone kill,nyc
help trying person,help trying person,nyc
got call casual dickwad driving rsd yesterday,got call casual dickwad driving rsd yesterday,nyc
help buying nj transit bus ticket app,help buying nj transit bus ticket app,nyc
brooklyn manhattan queen bronx,brooklyn manhattan queen bronx,nyc
found lost key amp earbuds g train,found lost key amp earbuds g train,nyc
found ring,found ring,nyc
psa check unit meter bill unusual coned charged x normal gas use mistake,psa check unit meter bill unusual coned charged x normal gas use mistake,nyc
int l soros child rape ring backed pres trump billion bribe pelosi rec b ensure safe passage border rapist include obama schumer cuomo buttgieg deblasio dorsey theil bmurray billion payoff death rape buffalo jan listen,int l soros child rape ring backed pres trump billion bribe pelosi rec b ensure safe passage border rapist include obama schumer cuomo buttgieg deblasio dorsey theil bmurray billion payoff death rape buffalo jan listen,nyc
editorial board,editorial board,nyc
hello everyone small bunch clothes jean belt variable using would sell quick cash way sell store doe live queen,hello everyone small bunch clothes jean belt variable using would sell quick cash way sell store doe live queen,nyc
sample spice blend,sample spice blend,nyc
getting nd postponement jury duty centre street,getting nd postponement jury duty centre street,nyc
medical card,medical card,nyc
see fall foliage,see fall foliage,nyc
buy heart dog stuffed toy replace lost daughter,buy heart dog stuffed toy replace lost daughter,nyc
manhattan library open ish,manhattan library open ish,nyc
idea mta open voluntary program help clean station guide incentive reduced fare free ride actual worker could focus cleaning complex wall actual cart,idea mta open voluntary program help clean station guide incentive reduced fare free ride actual worker could focus cleaning complex wall actual cart,nyc
int l soros child rape ring backed pres trump billion bribe pelosi rec b ensure safe passage border rapist include obama schumer cuomo buttgieg deblasio dorsey theil bmurray billion payoff death rape buffalo jan listen,int l soros child rape ring backed pres trump billion bribe pelosi rec b ensure safe passage border rapist include obama schumer cuomo buttgieg deblasio dorsey theil bmurray billion payoff death rape buffalo jan listen,nyc
vote five proposal ballot,vote five proposal ballot,nyc
suggest state fair,suggest state fair,nyc
internet service provider open competition spectrum optimum,internet service provider open competition spectrum optimum,nyc
free bombay bicycle club ticket tonight,free bombay bicycle club ticket tonight,nyc
altice mobile mo unlimited,altice mobile mo unlimited,nyc
shoe shine,shoe shine,nyc
high school discord,high school discord,nyc
negative gruesome post trying make stay away,negative gruesome post trying make stay away,nyc
halloween event,halloween event,nyc
broadway train building,broadway train building,nyc
coney island mid october,coney island mid october,nyc
salsa rooftop bar weekend suggestion,salsa rooftop bar weekend suggestion,nyc
weather march,weather march,nyc
train service sq st hunter pt av direction someone struck train near vernon blvd jackson av,train service sq st hunter pt av direction someone struck train near vernon blvd jackson av,nyc
right take dad rent stabilized lease,right take dad rent stabilized lease,nyc
